{
  "schemaVersion": "1.0.0",
  "analysisId": "analysis-valid-001",
  "source": {
    "applicationId": "application-001",
    "uploadedFileId": "file-001"
  },
  "observations": {
    "documentType": {
      "value": "Barangay clearance",
      "confidence": 0.98
    },
    "applicantName": {
      "value": "Juan Dela Cruz",
      "confidence": 0.97
    },
    "address": {
      "value": "123 Mabini Street, Quezon City",
      "confidence": 0.94
    },
    "readability": {
      "status": "clear",
      "confidence": 0.99
    }
  },
  "decisions": {
    "outcome": "complete",
    "missingInformation": []
  }
}
